{
  "schemaVersion": 3,
  "id": "1d2e3f4a-6b7c-4d8e-9f0a-1b2c3d4e5f06",
  "name": "Defaults 預設",
  "elements": [
    { "type": "armor_stand", "localId": 5, "offset": [0, 0, 0] },
    { "type": "display", "localId": 7, "offset": [0.5, 0, 0], "kind": "TEXT", "text": "哈囉" },
    { "type": "display", "localId": 9, "offset": [0, 0, 0.5], "kind": "ITEM", "item": { "id": "minecraft:apple" } }
  ]
}
